<?xml version="1.0" encoding="UTF-8"?>
<vitalSigns xmlns="urn:hl7-org:greencda:consol" xmlns:gdt="urn:hl7-org:greencda:datatypes"
	xmlns:xsi="http://www.w3.org/2001/XMLSchema-instance"
	xsi:schemaLocation="urn:hl7-org:greencda:consol GreenVitalSigns.xsd ">
	<vitalSignsOrganizer>
		<effectiveTime nullFlavor="NI" />
		<vitalSign>
			<vitalSignID nullFlavor="NI" />
			<!-- <vitalSignType code="8480-6" displayName="Systolic BP" /> -->
			<vitalSignType>8480-6</vitalSignType>
			<vitalSignDateTime nullFlavor="NI" />
			<vitalSignValue value="115" unit="mm[Hg]" />
		</vitalSign>
		<vitalSign>
			<vitalSignID nullFlavor="NI" />
			<!-- <vitalSignType code="8462-4" displayName="Diastolic BP" /> -->
			<vitalSignType>8462-4</vitalSignType>
			<vitalSignDateTime nullFlavor="NI" />
			<vitalSignValue value="70" unit="mm[Hg]" />
		</vitalSign>
		<vitalSign>
			<vitalSignID nullFlavor="NI" />
			<!-- <vitalSignType code="8867-4" displayName="Heart beat" /> -->
			<vitalSignType>8867-4</vitalSignType>
			<vitalSignDateTime nullFlavor="NI" />
			<vitalSignValue value="50" unit="/min" />
		</vitalSign>
	</vitalSignsOrganizer>
</vitalSigns>
